{"$schema":"https://json-schema.org/draft/2020-12/schema","title":"QSOL-INT Reference Methodologies","type":"object","required":["type","protocol","version","references"],"properties":{"type":{"const":"qsol-int-reference-methodologies"},"protocol":{"const":"QSOL-INT"},"version":{"type":"string"},"references":{"type":"array","minItems":1,"items":{"type":"object","required":["id","repository","ref","pinned_commit","license","canonical_for_int","parent_protocol","source_files","adopted_patterns","int_translation"],"properties":{"pinned_commit":{"type":"string","pattern":"^[0-9a-f]{40}$"},"canonical_for_int":{"const":false},"parent_protocol":{"const":false}}}}}}
